{
  "id": "rout_2026_07_14_filing_material_v0_5d1d3da9a3",
  "contractVersion": "skill_rule_contract_v0",
  "ruleId": "filing_material_v0",
  "pipeline": "filing_pipeline",
  "rawArtifactId": "raw_2026_07_14_static_cninfo_com_cn_de4028c747",
  "sourceId": "src_static_cninfo_com_cn_de4028c747",
  "routeDecisionId": "route_2026_07_14_f4e7dcd17584",
  "generatedAt": "2026-07-23T09:31:20+08:00",
  "payloadStatus": "metadata_only",
  "claimCandidates": [
    {
      "claimType": "filing",
      "text": "兴业银锡存在待审核公告/披露材料《董事及高级管理人员薪酬与绩效考核管理制度（2026年7月）》。",
      "normalizedFact": "兴业银锡 has filing/disclosure material: \"董事及高级管理人员薪酬与绩效考核管理制度（2026年7月）\".",
      "confidence": "medium",
      "publishedAt": "2026-07-14",
      "whyNow": "Router 将原始材料分配至 filing_pipeline，Skill Rule Contract 生成待审核披露事实候选。",
      "notes": "Generated by filing_pipeline rule at 2026-07-23T09:31:20+08:00. Review required."
    }
  ],
  "evidenceCandidates": [
    {
      "relation": "mentions",
      "sourceLevel": "A",
      "strength": "medium",
      "quote": "董事及高级管理人员薪酬与绩效考核管理制度（2026年7月）",
      "notes": "Disclosure material mentions a candidate fact. Review required."
    }
  ],
  "unknowns": [
    {
      "field": "filing_materiality",
      "reason": "披露材料与研究主题的关系未确认。",
      "severity": "medium"
    }
  ],
  "followupHints": [
    {
      "kind": "filing_review",
      "description": "阅读披露正文，判断是否构成正式事件、follow-up 或数据缺口。",
      "priority": "medium",
      "dueAt": null
    }
  ],
  "dataGaps": [
    {
      "kind": "raw_payload_not_fetched",
      "description": "Ingestion captured source metadata only; raw body retrieval is not enabled for this source yet.",
      "severity": "medium"
    }
  ],
  "extractedFields": [],
  "timeFields": {
    "occurredAt": null,
    "publishedAt": "2026-07-14",
    "firstSeenAt": "2026-07-23T09:31:19+08:00",
    "capturedAt": "2026-07-23T09:31:19+08:00",
    "processedAt": "2026-07-23T09:31:20+08:00",
    "dueAt": null,
    "resolvedAt": null
  },
  "reviewRequirements": [
    {
      "kind": "read_disclosure_body",
      "description": "人工阅读披露正文后再决定是否 promotion。",
      "required": true
    }
  ],
  "notes": "Skill Rule Contract v0 output. Review is required before promotion."
}
