{
  "id": "rout_2026_08_25_filing_material_v0_fd9f08e1fb",
  "contractVersion": "skill_rule_contract_v0",
  "ruleId": "filing_material_v0",
  "pipeline": "filing_pipeline",
  "rawArtifactId": "raw_2026_08_25_static_cninfo_com_cn_878909db83",
  "sourceId": "src_static_cninfo_com_cn_878909db83",
  "routeDecisionId": "route_2026_08_25_c5c124d7f734",
  "generatedAt": "2026-08-25T16:16:14+08:00",
  "payloadStatus": "metadata_only",
  "claimCandidates": [
    {
      "claimType": "filing",
      "text": "中国石化存在待审核公告/披露材料《中国石化H股公告-翌日披露表格》。",
      "normalizedFact": "中国石化 has filing/disclosure material: \"中国石化H股公告-翌日披露表格\".",
      "confidence": "medium",
      "publishedAt": "2026-08-25",
      "whyNow": "Router 将原始材料分配至 filing_pipeline，Skill Rule Contract 生成待审核披露事实候选。",
      "notes": "Generated by filing_pipeline rule at 2026-08-25T16:16:14+08:00. Review required."
    }
  ],
  "evidenceCandidates": [
    {
      "relation": "mentions",
      "sourceLevel": "A",
      "strength": "medium",
      "quote": "中国石化H股公告-翌日披露表格",
      "notes": "Disclosure material mentions a candidate fact. Review required."
    }
  ],
  "unknowns": [
    {
      "field": "filing_materiality",
      "reason": "披露材料与研究主题的关系未确认。",
      "severity": "medium"
    }
  ],
  "followupHints": [
    {
      "kind": "filing_review",
      "description": "阅读披露正文，判断是否构成正式事件、follow-up 或数据缺口。",
      "priority": "medium",
      "dueAt": null
    }
  ],
  "dataGaps": [
    {
      "kind": "raw_payload_not_fetched",
      "description": "Ingestion captured source metadata only; raw body retrieval is not enabled for this source yet.",
      "severity": "medium"
    }
  ],
  "extractedFields": [],
  "timeFields": {
    "occurredAt": null,
    "publishedAt": "2026-08-25",
    "firstSeenAt": "2026-08-25T16:16:13+08:00",
    "capturedAt": "2026-08-25T16:16:13+08:00",
    "processedAt": "2026-08-25T16:16:14+08:00",
    "dueAt": null,
    "resolvedAt": null
  },
  "reviewRequirements": [
    {
      "kind": "read_disclosure_body",
      "description": "人工阅读披露正文后再决定是否 promotion。",
      "required": true
    }
  ],
  "notes": "Skill Rule Contract v0 output. Review is required before promotion."
}
