{
  "id": "rout_2026_08_21_event_material_v0_c7209b2b21",
  "contractVersion": "skill_rule_contract_v0",
  "ruleId": "event_material_v0",
  "pipeline": "event_pipeline",
  "rawArtifactId": "raw_2026_08_21_static_cninfo_com_cn_43eec45fdd",
  "sourceId": "src_static_cninfo_com_cn_43eec45fdd",
  "routeDecisionId": "route_2026_08_21_7798a4a265b3",
  "generatedAt": "2026-08-22T16:15:58+08:00",
  "payloadStatus": "metadata_only",
  "claimCandidates": [
    {
      "claimType": "other",
      "text": "概伦电子存在待审核材料《关于第三届职工代表大会第一次会议决议公告》。",
      "normalizedFact": "概伦电子 has review material: \"关于第三届职工代表大会第一次会议决议公告\".",
      "confidence": "low",
      "publishedAt": "2026-08-21",
      "whyNow": "Pipeline 通过 Skill Rule Contract 生成待审核事实候选。",
      "notes": "Generated by event_pipeline rule at 2026-08-22T16:15:58+08:00. Review required."
    }
  ],
  "evidenceCandidates": [
    {
      "relation": "mentions",
      "sourceLevel": "A",
      "strength": "weak",
      "quote": "关于第三届职工代表大会第一次会议决议公告",
      "notes": "Generic rule output. Review required."
    }
  ],
  "unknowns": [
    {
      "field": "claim_specificity",
      "reason": "该 pipeline 尚未实现专用规则，候选事实粒度较粗。",
      "severity": "medium"
    }
  ],
  "followupHints": [
    {
      "kind": "rule_upgrade",
      "description": "为 event_pipeline 补充专用 Skill Rule Contract 实现。",
      "priority": "medium",
      "dueAt": null
    }
  ],
  "dataGaps": [
    {
      "kind": "raw_payload_not_fetched",
      "description": "Ingestion captured source metadata only; raw body retrieval is not enabled for this source yet.",
      "severity": "medium"
    }
  ],
  "extractedFields": [],
  "timeFields": {
    "occurredAt": null,
    "publishedAt": "2026-08-21",
    "firstSeenAt": "2026-08-22T16:15:52+08:00",
    "capturedAt": "2026-08-22T16:15:52+08:00",
    "processedAt": "2026-08-22T16:15:58+08:00",
    "dueAt": null,
    "resolvedAt": null
  },
  "reviewRequirements": [
    {
      "kind": "manual_claim_extraction",
      "description": "人工确认事实字段后再 promotion。",
      "required": true
    }
  ],
  "notes": "Skill Rule Contract v0 output. Review is required before promotion."
}
