{
  "id": "rout_2026_08_27_filing_material_v0_515a82d7a0",
  "contractVersion": "skill_rule_contract_v0",
  "ruleId": "filing_material_v0",
  "pipeline": "filing_pipeline",
  "rawArtifactId": "raw_2026_08_27_static_cninfo_com_cn_cd9e090843",
  "sourceId": "src_static_cninfo_com_cn_cd9e090843",
  "routeDecisionId": "route_2026_08_27_4aa63a01a7f1",
  "generatedAt": "2026-08-27T16:33:03+08:00",
  "payloadStatus": "metadata_only",
  "claimCandidates": [
    {
      "claimType": "filing",
      "text": "概伦电子存在待审核公告/披露材料《关于参加科创板2026年半年度芯片设计行业集体业绩说明会的公告》。",
      "normalizedFact": "概伦电子 has filing/disclosure material: \"关于参加科创板2026年半年度芯片设计行业集体业绩说明会的公告\".",
      "confidence": "medium",
      "publishedAt": "2026-08-27",
      "whyNow": "Router 将原始材料分配至 filing_pipeline，Skill Rule Contract 生成待审核披露事实候选。",
      "notes": "Generated by filing_pipeline rule at 2026-08-27T16:33:03+08:00. Review required."
    }
  ],
  "evidenceCandidates": [
    {
      "relation": "mentions",
      "sourceLevel": "A",
      "strength": "medium",
      "quote": "关于参加科创板2026年半年度芯片设计行业集体业绩说明会的公告",
      "notes": "Disclosure material mentions a candidate fact. Review required."
    }
  ],
  "unknowns": [
    {
      "field": "filing_materiality",
      "reason": "披露材料与研究主题的关系未确认。",
      "severity": "medium"
    }
  ],
  "followupHints": [
    {
      "kind": "filing_review",
      "description": "阅读披露正文，判断是否构成正式事件、follow-up 或数据缺口。",
      "priority": "medium",
      "dueAt": null
    }
  ],
  "dataGaps": [
    {
      "kind": "raw_payload_not_fetched",
      "description": "Ingestion captured source metadata only; raw body retrieval is not enabled for this source yet.",
      "severity": "medium"
    }
  ],
  "extractedFields": [],
  "timeFields": {
    "occurredAt": null,
    "publishedAt": "2026-08-27",
    "firstSeenAt": "2026-08-27T16:32:40+08:00",
    "capturedAt": "2026-08-27T16:32:40+08:00",
    "processedAt": "2026-08-27T16:33:03+08:00",
    "dueAt": null,
    "resolvedAt": null
  },
  "reviewRequirements": [
    {
      "kind": "read_disclosure_body",
      "description": "人工阅读披露正文后再决定是否 promotion。",
      "required": true
    }
  ],
  "notes": "Skill Rule Contract v0 output. Review is required before promotion."
}
