{
  "id": "rout_2026_06_25_event_material_v0_4415e38505",
  "contractVersion": "skill_rule_contract_v0",
  "ruleId": "event_material_v0",
  "pipeline": "event_pipeline",
  "rawArtifactId": "raw_2026_06_25_agibot_com_cn_e39f8dfa5d",
  "sourceId": "src_agibot_com_cn_e39f8dfa5d",
  "routeDecisionId": "route_2026_06_25_aa22fd0abf4e",
  "generatedAt": "2026-07-06T12:02:00+08:00",
  "payloadStatus": "metadata_only",
  "claimCandidates": [
    {
      "claimType": "other",
      "text": "智元创新（上海）科技股份有限公司存在待审核材料《全球首个3C产线质检工段全覆盖机器人作业直播，智元加速“部署态”规模化落地》。",
      "normalizedFact": "智元创新（上海）科技股份有限公司 has review material: \"全球首个3C产线质检工段全覆盖机器人作业直播，智元加速“部署态”规模化落地\".",
      "confidence": "low",
      "publishedAt": "2026-06-25",
      "whyNow": "Pipeline 通过 Skill Rule Contract 生成待审核事实候选。",
      "notes": "Generated by event_pipeline rule at 2026-07-06T12:02:00+08:00. Review required."
    }
  ],
  "evidenceCandidates": [
    {
      "relation": "mentions",
      "sourceLevel": "A",
      "strength": "weak",
      "quote": "全球首个3C产线质检工段全覆盖机器人作业直播，智元加速“部署态”规模化落地",
      "notes": "Generic rule output. Review required."
    }
  ],
  "unknowns": [
    {
      "field": "claim_specificity",
      "reason": "该 pipeline 尚未实现专用规则，候选事实粒度较粗。",
      "severity": "medium"
    }
  ],
  "followupHints": [
    {
      "kind": "rule_upgrade",
      "description": "为 event_pipeline 补充专用 Skill Rule Contract 实现。",
      "priority": "medium",
      "dueAt": null
    }
  ],
  "dataGaps": [
    {
      "kind": "raw_payload_not_fetched",
      "description": "Ingestion captured source metadata only; raw body retrieval is not enabled for this source yet.",
      "severity": "medium"
    }
  ],
  "extractedFields": [],
  "timeFields": {
    "occurredAt": null,
    "publishedAt": "2026-06-25",
    "firstSeenAt": "2026-07-06T12:02:00+08:00",
    "capturedAt": "2026-07-06T12:02:00+08:00",
    "processedAt": "2026-07-06T12:02:00+08:00",
    "dueAt": null,
    "resolvedAt": null
  },
  "reviewRequirements": [
    {
      "kind": "manual_claim_extraction",
      "description": "人工确认事实字段后再 promotion。",
      "required": true
    }
  ],
  "notes": "Skill Rule Contract v0 output. Review is required before promotion."
}
