{
  "id": "rout_2026_05_08_filing_material_v0_3fa04b95da",
  "contractVersion": "skill_rule_contract_v0",
  "ruleId": "filing_material_v0",
  "pipeline": "filing_pipeline",
  "rawArtifactId": "raw_2026_05_08_static_cninfo_com_cn_9c6275e943",
  "sourceId": "src_static_cninfo_com_cn_9c6275e943",
  "routeDecisionId": "route_2026_05_08_efbb331f28b2",
  "generatedAt": "2026-07-23T16:16:20+08:00",
  "payloadStatus": "metadata_only",
  "claimCandidates": [
    {
      "claimType": "filing",
      "text": "汉威科技存在待审核公告/披露材料《关于汉威科技集团股份有限公司2025年年度股东会的法律意见书》。",
      "normalizedFact": "汉威科技 has filing/disclosure material: \"关于汉威科技集团股份有限公司2025年年度股东会的法律意见书\".",
      "confidence": "medium",
      "publishedAt": "2026-05-08",
      "whyNow": "Router 将原始材料分配至 filing_pipeline，Skill Rule Contract 生成待审核披露事实候选。",
      "notes": "Generated by filing_pipeline rule at 2026-07-23T16:16:20+08:00. Review required."
    }
  ],
  "evidenceCandidates": [
    {
      "relation": "mentions",
      "sourceLevel": "A",
      "strength": "medium",
      "quote": "关于汉威科技集团股份有限公司2025年年度股东会的法律意见书",
      "notes": "Disclosure material mentions a candidate fact. Review required."
    }
  ],
  "unknowns": [
    {
      "field": "filing_materiality",
      "reason": "披露材料与研究主题的关系未确认。",
      "severity": "medium"
    }
  ],
  "followupHints": [
    {
      "kind": "filing_review",
      "description": "阅读披露正文，判断是否构成正式事件、follow-up 或数据缺口。",
      "priority": "medium",
      "dueAt": null
    }
  ],
  "dataGaps": [
    {
      "kind": "raw_payload_not_fetched",
      "description": "Ingestion captured source metadata only; raw body retrieval is not enabled for this source yet.",
      "severity": "medium"
    }
  ],
  "extractedFields": [],
  "timeFields": {
    "occurredAt": null,
    "publishedAt": "2026-05-08",
    "firstSeenAt": "2026-07-23T16:16:14+08:00",
    "capturedAt": "2026-07-23T16:16:14+08:00",
    "processedAt": "2026-07-23T16:16:20+08:00",
    "dueAt": null,
    "resolvedAt": null
  },
  "reviewRequirements": [
    {
      "kind": "read_disclosure_body",
      "description": "人工阅读披露正文后再决定是否 promotion。",
      "required": true
    }
  ],
  "notes": "Skill Rule Contract v0 output. Review is required before promotion."
}
